{
    "$schema": "http://json-schema.org/draft-07/schema#",
    "title": "Agent Manifest",
    "description": "A formal signature for an agent, describing its capabilities.",
    "type": "object",
    "properties": {
        "name": {
            "description": "The unique name of the agent.",
            "type": "string"
        },
        "description": {
            "description": "A high-level description of the agent's purpose.",
            "type": "string"
        },
        "preconditions": {
            "description": "The resources that the agent consumes.",
            "type": "array",
            "items": {
                "type": "object",
                "properties": {
                    "name": {
                        "description": "The name of the resource (e.g., raw_data).",
                        "type": "string"
                    },
                    "description": {
                        "description": "A description of the resource.",
                        "type": "string"
                    }
                },
                "required": ["name", "description"]
            }
        },
        "postconditions": {
            "description": "The resources that the agent produces.",
            "type": "array",
            "items": {
                "type": "object",
                "properties": {
                    "name": {
                        "description": "The name of the resource (e.g., analysis_report).",
                        "type": "string"
                    },
                    "description": {
                        "description": "A description of the resource.",
                        "type": "string"
                    }
                },
                "required": ["name", "description"]
            }
        }
    },
    "required": ["name", "description", "preconditions", "postconditions"]
}
