{
    "name": "create_file",
    "description": "A tool for creating a file with the given content.",
    "preconditions": [
        {
            "name": "filename",
            "description": "The name of the file to create."
        },
        {
            "name": "content",
            "description": "The content to write to the file."
        }
    ],
    "postconditions": [
        {
            "name": "filename",
            "description": "The name of the file that was created."
        }
    ]
}
